{
  "route_version": "1.0",
  "trigger": {
    "type": "schedule",
    "schedule": {
      "cron": "0 0 * * *"
    }
  },
  "invoke": {
    "plan_ref": "maintenance.daily_cleanup"
  },
  "policies": {
    "timeout_ms": 300000,
    "dlq": {
      "enabled": true,
      "target": "maintenance_failures"
    },
    "budget_ms": 600000
  }
}
